Sheet: Sheet1
C1: Vans RV-10A | D1: Vans RV-7A | E1: Vans RV-9A | F1: Vans RV-14A | G1: TAC Sling 2 | H1: TAC Sling 2 | I1: TAC Sling 4 | J1: TAC Sling TSi
C2: 260hp | D2: 200hp | E2: 160hp | F2: 210hp | G2: 912ULS | H2: 914UL | I2: 914UL | J2: 915iS
A3: Aerobatic
A4: $ Airframe | B4: (AUD) | C4: of:=SUM(4230;11200;16925;16425)*[.B23] -> 68779.8 | D4: of:=SUM(10;1960;8395;7325;7575)*[.B23] -> 35623.65 | E4: of:=SUM(10;1940;8695;7325;7650)*[.B23] -> 36124.2 | F4: of:=SUM(4335;8045;9975;13200)*[.B23] -> 50132.55 | G4: of:=36740*1.1 -> 40414 | H4: of:=36740*1.1 -> 40414 | I4: of:=48026*1.1 -> 52828.6 | J4: of:=52855*1.1 -> 58140.5
A5: $ Quickbuild | B5: (AUD) | C5: of:=SUM(4230;41450;16425)*[.B23]-[.C4] -> 18788.25 | D5: of:=SUM(10;1960;26950;7325)*[.B23]-[.D4] -> 15481.8 | E5: of:=SUM(10;1940;27560;7650)*[.B23]-[.E4] -> 16271.4 | F5: of:=SUM(4335;31100;13200)*[.B23]-[.F4] -> 18442.8 | G5: of:=12743*1.1 -> 14017.3 | H5: of:=12743*1.1 -> 14017.3 | I5: of:=15917*1.1 -> 17508.7 | J5: of:=17292*1.1 -> 19021.2
A6: $ Engine | B6: (AUD) | C6: of:=47700*[.B23] -> 67257 | D6: of:=33100*[.B23] -> 46671 | E6: of:=28500*[.B23] -> 40185 | F6: of:=33800*[.B23] -> 47658 | G6: of:=18700*1.1 -> 20570 | H6: of:=32500*1.1 -> 35750 | I6: of:=32500*1.1 -> 35750 | J6: of:=60012*1.1 -> 66013.2
A7: Cruise | B7: (kt) | C7: 175 | D7: 174 | E7: 164 | F7: 176 | G7: 114 | H7: 118 | I7: 130 | J7: 155
A8: Vne | B8: (kt) | C8: 200 | D8: 199 | E8: 171 | F8: 200 | G8: 135 | H8: 135 | I8: 135 | J8: 160
A9: Seats | C9: 4 | D9: 2 | E9: 2 | F9: 2 | G9: 2 | H9: 2 | I9: 4 | J9: 4
A10: Usable Load | B10: (kg) | C10: 431 | D10: 311 | E10: 328 | F10: 368 | G10: 330 | H10: 320 | I10: 450 | J10: 460
A11: Full Fuel Load | B11: (kg) | C11: of:=ROUND([.C10]-([.C14]*0.72)) -> 268 | D11: of:=ROUND([.D10]-([.D14]*0.72)) -> 197 | E11: of:=ROUND([.E10]-([.E14]*0.72)) -> 230 | F11: of:=ROUND([.F10]-([.F14]*0.72)) -> 231 | G11: of:=ROUND([.G10]-([.G14]*0.72)) -> 222 | H11: of:=ROUND([.H10]-([.H14]*0.72)) -> 212 | I11: of:=ROUND([.I10]-([.I14]*0.72)) -> 325 | J11: of:=ROUND([.J10]-([.J14]*0.72)) -> 338
A12: MTOW | B12: (kg) | C12: 1181 | D12: 815 | E12: 794 | F12: 930 | G12: 700 | H12: 700 | I12: 918 | J12: 950
A13: Fuel Burn | B13: (L/hr) | C13: 42 | D13: 32 | E13: 27 | F13: 35 | G13: 18 | H13: 21 | I13: 22 | J13: 30
A14: Fuel Capacity | B14: (L) | C14: 227 | D14: 159 | E14: 136 | F14: 190 | G14: 150 | H14: 150 | I14: 174 | J14: 170
A15: Range | B15: (km) | C15: 1600 | D15: 1239 | E15: 1143 | F15: 1510 | G15: 1400 | H15: 1350 | I15: 1450 | J15: 1480
A16: RoC | B16: (m/s) | C16: 7.4 | D16: 9.7 | E16: 7.1 | F16: 9.1 | G16: 4.3 | H16: 4.8 | I16: 3.8 | J16: 5.1
A17: Baggage | B17: (kg) | C17: 45.3 | D17: 45.3 | E17: 45.3 | F17: 45.3 | G17: 35 | H17: 35 | I17: 35 | J17: 25
A18: TKOF DIST | B18: (m) | C18: 415 | D18: 575 | E18: 475 | F18: 512 | G18: 600 | H18: 500 | I18: 700 | J18: 550
A19: LDG DIST | B19: (m) | C19: 500 | D19: 500 | E19: 450 | F19: 550 | G19: 370 | H19: 370 | I19: 500 | J19: 558
A20: Ceiling | B20: (ft) | C20: 20000 | D20: 22000 | E20: 24500 | F20: 18000 | G20: 13000 | H20: 15000 | I20: 15000 | J20: 18000
A23: USD to AUD | B23: 1.41